{
    "description": "Bessac, Jean-Claude, and R\u00e9my Boucharlat. 2010. \u201cLe monument de Takht-e Rustam, pr\u00e8s de Pers\u00e9polis dit \u2018tombeau inachev\u00e9 de Cambyse\u2019\u202f: Note technique et reconsid\u00e9rations.\u201d ARTA: Achaemenid Research on Texts and Archaeology 2010 (003): 1\u201339. http://www.achemenet.com/document/2010.003-Bessac&Boucharlat.pdf Bessac, Jean-Claude, and R\u00e9my Boucharlat. 2010. \u201cLe monument de Takht-e Rustam, pr\u00e8s de Pers\u00e9polis dit \u2018tombeau inachev\u00e9 de Cambyse\u2019\u202f: Note technique et reconsid\u00e9rations.\u201d ARTA: Achaemenid Research on Texts and Archaeology 2010 (003): 1\u201339. http://www.achemenet.com/document/2010.003-Bessac&Boucharlat.pdf", 
    "domain": "www.achemenet.com", 
    "identifiers": {}, 
    "is_part_of": {
        "issn": "2110-6118", 
        "title": "ARTA: Achaemenid Research on Texts and Archaeology", 
        "url": "http://www.achemenet.com/bookmark.do?link=arta"
    }, 
    "keywords": [
        "archaeology"
    ], 
    "language": [
        "fr", 
        1.0
    ], 
    "provenance": [], 
    "related_resources": [], 
    "subordinate_resources": [], 
    "title": "Bessac, Jean-Claude, and R\u00e9my Boucharlat. 2010", 
    "url": "http://www.achemenet.com/document/2010.003-Bessac&Boucharlat.pdf", 
    "volume": "2010", 
    "year": null, 
    "zotero_id": null
}