{
    "description": "Stolper, Matthew W., and Jan Tavernier. 2007. \u201cFrom the Persepolis Fortification Archive Project, 1: An Old Persian Administrative Tablet from the Persepolis Fortification.\u201d ARTA: Achaemenid Research on Texts and Archaeology 2007 (001): 1\u201328. http://www.achemenet.com/document/2007.001-Stolper-Tavernier.pdf Stolper, Matthew W., and Jan Tavernier. 2007. \u201cFrom the Persepolis Fortification Archive Project, 1: An Old Persian Administrative Tablet from the Persepolis Fortification.\u201d ARTA: Achaemenid Research on Texts and Archaeology 2007 (001): 1\u201328. http://www.achemenet.com/document/2007.001-Stolper-Tavernier.pdf", 
    "domain": "www.achemenet.com", 
    "identifiers": {}, 
    "is_part_of": {
        "issn": "2110-6118", 
        "title": "ARTA: Achaemenid Research on Texts and Archaeology", 
        "url": "http://www.achemenet.com/bookmark.do?link=arta"
    }, 
    "keywords": [
        "fortifications", 
        "archaeology", 
        "archive"
    ], 
    "language": [
        "en", 
        1.0
    ], 
    "provenance": [], 
    "related_resources": [], 
    "subordinate_resources": [], 
    "title": "Stolper, Matthew W., and Jan Tavernier. 2007", 
    "url": "http://www.achemenet.com/document/2007.001-Stolper-Tavernier.pdf", 
    "volume": "2007", 
    "year": null, 
    "zotero_id": null
}